paper_id,comment,analyst,sentiment,pos-tally,neutral-tally,neg-tally
2801,"This is the second revision of the article “Urban IoT Ontologies for Sharing and Electric Mobility”. 

The paper describes a modular suite of ontologies representing data gathered from Urban IoT devices used in urban mobility, finally producing a conceptual model to harmonize data exchanges between municipalities and service providers, with a specific focus on sharing and electric mobility domains. The paper also describes the methodology followed for the development of the ontology and contains a set of examples and references to additional materials to better understand installation, queries, and evaluation of the model.

In the previous revision I emphasized the clarity of the exposition, and the relevance of the covered topics. In fact, no major changes to the structure of the paper were required, since it was already well organized. As far as the writing is concerned, therefore, authors basically corrected the typos and missing references that had been highlighted in the review. 
However, in my previous review, I underlined some shortcomings in the section of result evaluation dealing with Completeness. The authors have now added  the file CompetencyQuestion_Completeness.xlsx to the repository, including numerous Competency Question examples on most of the classes of the ontology. This is indeed a useful tool to test the Completeness of the model, therefore my only advice is to replace the full file with a link to a google sheet in read-only mode. I suggest this because from git hub it is not possible to view an xlsx file directly, unless you install git hub desktop: you can only download the excel locally, which may not be the ideal solution for users and information security. 
As for the long-term stable URL for resources, these are all organized in the git hub repository, introduced by a bilingual read_me. Moreover, the subfolders contain read_me description in English and/or properly commented code. The contents of each file are clear and consistent with the descriptions. I give a more than positive assessment to the material provided, and the same suggestion made for the  CompetencyQuestion_Completeness.xlsx file applies to all the other xlsx files. 
This new paper also complies with all my other suggestions.

In conclusion, my final recommendation is to accept the paper. Indeed, such an example of integration of ontologies and the use of existing vocabularies meets the needs of the users it refers to and clearly describes the context of reference, resulting in a good quality and relevance model. Moreover, its modularity also allows for future extension. 
Therefore, although its originality is not extraordinary, I appreciate not only the effort at the technical level, but also the detail and care in organizing heterogeneous data in the repository, and in explaining the problems and challenges faced and the results obtained. In fact, the work is complete and well documented.

",David Castro,positive,8,2,1
2819,"In this paper, authors introduce a novel approach which encompasses the aspect of interoperability to quality assessment of RDF data by identifying eleven interoperability dimensions by aligning a list of standardized dimensions regarding data quality to the “I” principles out of other FAIR data principles.

 

Authors also presented a tool by claiming its benefit for successfully identifying interoperability problems and could provide suggestions for resolving them.

 

It is a well written article and easy to read but following few points can be considered:

 

·      There is no discussion around the validation and evaluation of the approach. It would be great to see the precision and recall of the defined approach especially in terms of complexity analysis and accuracy of the approach as the size of the data grows i.e larger datasets.

 

·      As a proof of concept authors performed the quality assessment on a registry dataset about Addison’s disease and two synthetic datasets respectively about personal information and diagnosis from the European Joint Programme on Rare Disease (EJP RD). Addison's dataset was converted from a synthetic tabular dataset to an RDF dataset claiming the conversion scenario as typical/ useful for quality assessment.

Typically, in most of the cases converting relational databases/ tabular databases to RDF requires a good amount of domain knowledge especially when it comes to medical/ biomedical data sources. Considering the inherent feedback mechanism from domain experts during the conversion process the quality assessment and the results may differ on a case to case basis.

How realistic would it be to comment on the quality dimension based on metrics defined in this paper at the generalised level i.e, on other RDF datasets. Would the same approach, dimensions and metrics work for any RDF resource?

Nevertheless, it would be great to see results in real world settings (on existing RDF data sources) irrespective of domain, complexity, size and coverage in order to consider the quality metrics defined in this paper for interoperability dimensions.

 

·      Most of the data sources are dynamic in nature these days. Does any of the quality metrics defined for interoperability dimension consider the assessment for such scenarios?  

 

·    Twenty-nine failure types were defined in the Interoperability Failure Case (IFC) vocabulary which seems comprehensive but it is not explicitly clear if IFC is one of the contributions by authors or the re-use of existing vocab named “IFC”.

 

·      Would be good to see the false positive results while considering the failure matches based on the defined technique. Any analysis based on computed results would be great to see.

 

·      Some of the possible future directions are highlighted in the last paragraph of section 5 and would be good to present them as separate sections/ subsections for better visibility.

 

·      Clear statements regarding the limitation for the approach, data used and the developed tool should also be highlighted.",David Castro,negative,0,10,5
2833,"Despite the consideration made by the authors in the cover letter, this paper must be reviewed as ""Tools and Systems Report"". The paper is far from a full research paper and does not add relevant scientific contributions to the Semantic Web field; instead, it uses existing tools to create an event-based knowledge graph.

The topic addressed in the paper is very relevant, timely and well- introduced and motivated, inspiring its reading. On the other hand, the related work section is long, does not explain the paper's contributions in relation to the state-of-the-art and is difficult to follow.

The authors mention ""first step for building a knowledge graph was to decide the source of the documents, since there are important differences among jurisdictions, even when they share the language"". A suggestion to improve readability is to provide an example. I can only guess what the differences are.

The authors also mention ""From the analysis performed in the EventsMatter corpus, we can confirm the importance of the sections in identifying which events are relevant and which are not"". It would be better if the authors would let the readers 'confirm' by providing in-depth analysis and supporting data. The figures presented do not seem enough to confirm the importance of the sections rather than the frequency of facts.

The authors also mention that the ""Structure Extractor is currently able to handle the structure of the ECHR and ECJ documents, but in such a way that a new document type can be easily added"". Looking at the code and the lack of documentation/comments, it does not seem trivial to change a single line in the code provided. Paths are hard-coded, filenames are hard-coded and no design pattern was found to handle the extensibility claimed in this paragraph. An example is the method ""parseAndTag"". In general, section 3 is confusing and terms are mentioned without a proper introduction. For example, the authors say the EventsMatter corpus and only in a subsection it is 'properly' explained (same for the FrameNet). Section 3 requires restructuring. As mentioned before, a running example would help the authors to explain the process.

The presented ontology is also not well-explained. For example, the class ""ComposedTemporalExpression"" can be represented in other ontologies. Simplification can lead to other issues. Again, examples would allow readers to see the 'importance' of such class. 

The remaining sections suffer from similar issues.

Another main concern about the paper is the evaluation of the tool. The authors did not provide any evaluation/experiments—a critical point for a tool.

As previously mentioned, the code is available but not easy to run,  lacks documentation and coding standards are non-existent (https://www.oracle.com/java/technologies/javase/codeconventions-contents.html).

",David Castro,negative,1,4,12
2852,"1. Originality:
This paper introduces a neural network model where attention mechanisms are exploited to learn common object properties from the OWL2 ontology standard. 
Similar to what some of the co-authors proposed for the IterE model, this paper exploits axiom properties throughout its learning, but instead of learning rules guided by those properties, it uses those rules to implement an attention mechanism affecting the model embeddings.
In conclusion, it exploits recent deep learning techniques, trough attention mechanism, along with Ontology formalisms, which represents an original way of mixing deep learning and symbolic AI.

2. Significance of the results:
This paper provides tangible proofs about the value of ontologies' axiom information, in the learning process of knowledge graph embeddings.
Information on test results and the method used to produce them are well presented.
Results on the WN18RR with Hits@1 metric, being a very difficult task, are very good, and show potential advantage of this method for tasks where precision is needed in noisy (real life) settings.
The significance of those results is satisfactory but somewhat modest considering additional tests and evaluation would be needed to fully assess the level of improvement brought by this method on knowledge graph embeddings and its applicability to different type of datasets.
Nevertheless, it truly confirms the validity of the approach and applicability to certain use cases.

3. Quality of writing:
The quality of the writing is very basic, many sentences are missing words or using the wrong word, verb tense, etc., which makes reading unpleasant but does not affect the technical comprehension.

4. Paper Code/Resources:
The github reference was created but is empty (at least the public branch), which makes it impossible to review the solution code quality, reproduce results and confirm whether artifacts will be available.",David Castro,positive,5,0,2
2866,"The manuscript was submitted as 'Data Description'. It describes a linked dataset of SPARQL query logs (LSQ), version 2.0. LSQ 2.0 features logs from 27 SPARQL endpoints and describes 43.9 million SPARQL query executions on these endpoints. The paper is an extension to a paper ""LSQ: The Linked SPARQL Queries Dataset"" published on ISWC 2015. The submited extended version has the same structure as the previous paper. Both papers consider the same set of use cases for the LSQ dataset and both introduce the same data model for representing query logs. The reviewed paper describes significant extensions compared to the first version from 2015. This includes a significant extension with more datasets, queries and query executions, and more detailed statistics. Also a broad usage of the dataset is presented in a structured form which transparently shows various recent research works which used LSQ for the evaluation. The paper shows only the usage of LSQ 1.0. However, this clearly proves the usefulness of the dataset. The new version as a significant extension to the first version will undoubtedly find a broad usage as a pool of queries for various benchmarks.

In summary, even though the paper does not bring anything ground breaking compared to the paper from 2015, it shall be published in my opinion. It is necessary to inform the research community about the new version of the dataset. The paper contains all necessary information the readers need to start using the dataset.

I have two minor issues related to the information provided about the dataset in the paper.

I1) Metrics and statistics on external and internal connectivity of the dataset: The SPARQL endpoints are described in a LSQ specific way. However, existing descriptions of SPARQL endpoints expressed as VOID resources could be linked instead.
I2) Use of established vocabularies: This is related to the previous issue. On page 4, Query instance, the authors describe that the originating endpoint of a query is associated with the dataset using a LSQ specific property lsqv:endpoint. The reason is that void:endpoint or sd:endpoint could not be used because they have different domains. It is a strange reason. For example, a LSQ query can be associated with a void:Dataset using a LSQ specific property. Then it would be possible to use void:endpoint (https://www.w3.org/TR/void/#sparql). I understand that it is not possible now to change the vocabulary. However, the rationale behind this design decision should be justified better.

The paper demonstrates the necessary level of the maturity of the dataset, including its quality, stability, and usefulness proved by the usage of the dataset by many researchers as a benchmark for evaluating their results. The description of the dataset is at the necessary level of detail. I have two minor issues related to the clarity of the description.

I3) Page 4, query instance: The property lsqv:endpoint is described in the text with lsqv:Query as a domain. However, Fig. 1 shows that the domain of lsqv:endpoint is lsqv:RemoteExec. The textual description of the LSQV vocabulary is inconsistent with the figure.

I4) Page 4, static features: It is described that static features are defined for a query, independently of the dataset over which the query is evaluated. However, the paragraph above describes that queries are considered only in the relation to an endpoint. In other words, an instance of lsqv:Query is always a pair of SPARQL expression and endpoint. LSQV does not allow to describe features of queries independently of the endpoints. Therefore, the paragraphs ""Query instance"" and ""Static features"" on page 4 are in a contradiction.

Regarding the LSQ data file

(A) It is well organized and available for download as well as via a SPARQL endpoint through an access page http://lsq.aksw.org/. The access page contains necessary information about the access to the dataset.

(B) The provided resources are complete for replication of experiments. The access page provides also tools for the experiments and their documentation.  

(C) LSQ is not available through a public repository such as GitHub, Figshare or Zenodo. The authors use their own web server which seems appropriate for long-term discoverability. LSQ does not have a DOI.

(D) The provided data artifacts are complete. The LSQ dump is structured to files for individual SPARQL endpoints. The content for each endpoint seems complete.",David Castro,neutral,13,7,13
2885,"""(1) Quality, importance, and impact of the described tool or system (convincing evidence must be provided). ""
------------------
This paper presents TermItUp, a generic architecture integrating multiple state of the art tools with the purpose of providing a one-stop-shop for all terminology extraction needs. 
The tool has been developed following FAIR and open science principles, using standard LLOD and LOD formats, guided by a set of requirements based on observations in the state of the art, 
but also discussions with terminology experts. 
The tool will be an extremely useful to the community as the systematic integration of its different components for each single project would be incredibly time-consuming and ad-hoc.
There are high impact uses of the tool in H2020 and other collaborative projects, showcasing the potential of the tool. 


""(2) Clarity, illustration, and readability of the describing paper, which shall convey to the reader both the capabilities and the limitations of the tool. Please also assess the data file provided by the authors under “Long-term stable URL for resources”.""
------------------
The paper is well written and organized, and clearly tell the story of TermItUp in terms of its capabilities and shortcomings. 
There are small language corrections to be made for the camera ready version, highlighted at the end of this review. 

The review of literature is complete, although I would have preferred to see at least a mention of SOTA efforts for terminology-extraction around TermEval2020/ACTER and an explanations as to why such systems although theoretically very accurate would be very difficult to integrate in a production system. 
There's a very interesting multilingual extraction system in the 2021 finding of the ACL https://aclanthology.org/2021.findings-acl.316.pdf
I mention this because it's interesting, but the positioning of the paper doesn't necessarily require to go into this particular literature. 
Perhaps the mention in the paper that there are ongoing efforts for multilingual terminology extraction actually refers to this. 

Regarding the perspectives, I would love to see the future integration of a knowledge-graph aware association rule mining approach in addition to the extraction of hierarchical relations. 
I am not asking to mention this in the paper, just an interesting thought. 


""In particular, assess (A) whether the data file is well organized and in particular contains a README file which makes it easy for you to assess the data,
(B) whether the provided resources appear to be complete for replication of experiments, and if not, why,
(C) whether the chosen repository, if it is not GitHub, Figshare or Zenodo, is appropriate for long-term repository discoverability, and 
(4) whether the provided data artifacts are complete. Please refer to the <a href=""/reviewers"" target=""_blank"">reviewer instructions</a> and the <a href=""/faq"" target=""_blank"">FAQ</a> for further information.""
------------------

The github repository is easily accessible and significant information is given in the README or on the main website of the tool. 
The overall explanations are clear and the documentation of the API provided through swagger is very helpful. 
The main improvement directions would be 1/adding a more technical documentation that explains how to deploy the service 2/adding some docstring documentation for developers 
3/potentially refactor the code base if there is a subsequent increase in complexity, I would personally favour a generic class structure with polymorphic genericity rather than reflexively loading code modules that all include the same functions, even though the latter tends to create less overhead. 
As the tool is still a prototype under active development, those are not significant issues with regard to the publication of the paper. 



**I recommend acceptance of the paper**, the corrections are mostly cosmetic for the camera ready. 



***Detailed corrections***

Page 2 line 12 left: the bit of the sentence about DBPedia is confusing, I don't understand what it means. 

P2 l19 left: is to find -> is finding

P2 l25: different backgrounds and expertise levels to face language and related needs [...]

P2 l30 right: discussions that have arisen

P2 l37 right: This section covers 

P2 l38 right: different processes mobilized in our system

P3 l42-43 right: Combining Wikipedia and other resources, BebelNet constitutes an multilingual [...]

P4 l9 left: domains, with half being closely related to [...]

P4 l10 left: Several scientific works are devoted

P4 l12 left: a SPARQL

P4 l28 left: can be of great help

P4 l6 right: corpus -> corpora 

P4 l36 right: These can correspond to  different [...]

P4 l43-45 right: The meaning of a unit is to be discovered in text and constructed  through relations to other terminological units. 

P5 l22 right: can significantly contribute to improving performance [...]

P5 l22 right: to developing

P5 l45 right: this translates to a necessity [...]

There are aditionnal small corrections like these to be made, can transmit feedback to authors later as time permits, preferable to delaying the review submission.",David Castro,neutral,2,6,2
2898,"The authors have exhaustively addressed all previous comments, and I was very happy of the improvements.
The paper is much clearer and easier to follow. 

The presentation of the two methods used to align discourse segments and relations across the parallel corpora is clear and sound - description of Method II has improved a lot.

Editorial comments:
- move Table 2 to be closer to where it is referred to in the body of the document
- move Table 3 to be closer to where it is referred to in the body of the document
- pag 8 line 14: incriminating --> increasing?
- pag 9 lines 15/18: check for consistency the use of italics for the connectives in the body of the text
- pg 10 line 20  and following: when presenting the sources of errors, I would use the \paragraph{} command in LaTeX rather than starting the paragraphs with a sentence in italics
- Table 9 and Table 10: I would anticipate and discuss Table 10 first -move it to where Table 9 now is and then present and discuss Table 9",David Castro,positive,3,0,0
2904,"The paper presents the work to properly publish data under the principles of linked (open) data). To do so, the authors have promoted to the linked data initiative a dataset coming from Nova Scotia. 

The work is interesting and applicable to many domains in which sometimes data is published for the shake of publishing. However, there are some things to improve:

-In the abstract, it should be necessary to be more informative and quantify some adjectives like “most of datasets” to see some context and magnitude of the problem/context.

-Include also more technical details about the results: ontologies/semantics rules and provide some quality assessment if possible.

-In the introduction, some existing issues must be justified: ""The datasets act as isolated pools of information that cannot be queried or linked."" This implies to categorize and identify the current dimensions of the problem to be addressed:
--Problem of reusing data, Which are the principles? For instance, alignment to Open Science/Data principles, etc.

Then, establish the specific technical issues that are preventing a proper data federated environment: data modelling: linked data patterns? data integration, data quality, data querying mechanisms, lack of APIs, use of standards and existing vocabularies, etc. to finally assess if there are interoperability issues: interoperability issues: communication protocols, syntax and semantics

-In the state of the art/background section, there are multiple works about linked data lifecycles that must be mentioned. 

-In the methodology section, it would be nice to see some description of the datasets (type of data, issues in data: consistency, naming, etc., need of logics, etc.) to finally end with the decision on the vocabularies and data model including a description of what is being reused (with more details of the process) and what is new. 

-Regarding the semantic rules, does it make sense to directly use SPARQL to produce new facts? In terms of consistency, it should be nice to see the reconciliation process between entities (if it was necessary).

-Authors also show some SPARQL queries. It should be necessary to link the potential of these queries to the initial needs. 

-The quality checking of the dataset seems a bit simple. It would be also nice to see how to consume that information (if it is publicly available).

Finally, authors properly comment the main conclusions and envision some future work.
",David Castro,negative,2,11,3
